[
 {
  "seq": 1,
  "ts": 1788736411.7522643,
  "type": "log",
  "level": "info",
  "msg": "[1/1] TI: L_Insula"
 },
 {
  "seq": 4,
  "ts": 1788736411.7574189,
  "type": "log",
  "level": "info",
  "msg": "Config written: /mnt/000/derivatives/SimNIBS/sub-101/Simulations/L_Insula/documentation/config.json"
 },
 {
  "seq": 5,
  "ts": 1788736413.7628317,
  "type": "log",
  "level": "info",
  "msg": "SimNIBS simulation: Started"
 },
 {
  "seq": 6,
  "ts": 1788736413.7732003,
  "type": "log",
  "level": "info",
  "msg": "Head Mesh:          /mnt/000/derivatives/SimNIBS/sub-101/m2m_101/101.msh"
 },
 {
  "seq": 7,
  "ts": 1788736413.773539,
  "type": "log",
  "level": "info",
  "msg": "Subject Path:       /mnt/000/derivatives/SimNIBS/sub-101/m2m_101"
 },
 {
  "seq": 8,
  "ts": 1788736413.773677,
  "type": "log",
  "level": "info",
  "msg": "Simulation Folder:  /mnt/000/derivatives/SimNIBS/sub-101/Simulations/L_Insula/high_Frequency"
 },
 {
  "seq": 14,
  "ts": 1788736425.8631008,
  "type": "log",
  "level": "info",
  "msg": "Placing Electrode:\ndefinition: plane\nshape: ellipse\ncentre: E034\npos_ydir: []\ndimensions: [8, 8]\nthickness:[4, 2.0]\nchannelnr: 1\nnumber of holes: 0\n"
 },
 {
  "seq": 15,
  "ts": 1788736433.5288944,
  "type": "log",
  "level": "info",
  "msg": "Placing Electrode:\ndefinition: plane\nshape: ellipse\ncentre: E020\npos_ydir: []\ndimensions: [8, 8]\nthickness:[4, 2.0]\nchannelnr: 2\nnumber of holes: 0\n"
 },
 {
  "seq": 26,
  "ts": 1788736483.5923955,
  "type": "log",
  "level": "summary",
  "msg": "\n101_TDCS_1\n==========\nGray Matter\n\nField Percentiles\n-----------------\nTop percentiles of the field (or field magnitude for vector fields)\n|Field |99.9%        |99.0%        |95.0%        |\n|------|-------------|-------------|-------------|\n|E     |3.53e-01 V/m |2.39e-01 V/m |1.34e-01 V/m |\n|magnE |3.53e-01 V/m |2.39e-01 V/m |1.34e-01 V/m |\n\nField Focality\n---------------\nMesh volume or area with a field >= X% of the 99.9th percentile\n|Field |75.0%        |50.0%        |\n|------|-------------|-------------|\n|E     |4.21e+03 mm\u00b3 |1.78e+04 mm\u00b3 |\n|magnE |4.21e+03 mm\u00b3 |1.78e+04 mm\u00b3 |\n"
 },
 {
  "seq": 28,
  "ts": 1788736483.6472006,
  "type": "log",
  "level": "info",
  "msg": "Result Files:\n/mnt/000/derivatives/SimNIBS/sub-101/Simulations/L_Insula/high_Frequency/101_TDCS_1_scalar.msh"
 }
]